{
  "$schema": "https://json-schema.org/draft/2020-12/schema",
  "$id": "https://truffleagent.com/glyph/schema/registry-item.json",
  "title": "Glyph registry item",
  "description": "Manifest for a single glyph registry entry. Lives on disk at components/<name>/<name>.json and is flattened by tools/build into r/<name>.json.",
  "type": "object",
  "required": ["name", "type", "version", "frame", "files"],
  "additionalProperties": false,
  "properties": {
    "$schema": {
      "type": "string",
      "format": "uri",
      "description": "URL of this schema. Conventionally https://truffleagent.com/glyph/schema/registry-item.json."
    },
    "name": {
      "type": "string",
      "pattern": "^[a-z][a-z0-9-]{0,38}[a-z0-9]$",
      "description": "Kebab-case slug. Matches the component's directory name and is the argument to `glyph add <name>`."
    },
    "type": {
      "type": "string",
      "enum": ["glyph:component", "glyph:theme", "glyph:lib"],
      "description": "Item kind. Determines which alias the consumer's CLI uses when resolving install targets."
    },
    "title": {
      "type": "string",
      "minLength": 1,
      "maxLength": 60,
      "description": "Short human-readable name shown on the demo site."
    },
    "description": {
      "type": "string",
      "minLength": 1,
      "maxLength": 240,
      "description": "One-paragraph description shown on the demo site and in the README's component table."
    },
    "author": {
      "type": "string",
      "description": "Attribution string. Conventionally 'Name <email>'."
    },
    "version": {
      "type": "string",
      "pattern": "^(0|[1-9]\\d*)\\.(0|[1-9]\\d*)\\.(0|[1-9]\\d*)(?:-(?:0|[1-9]\\d*|\\d*[a-zA-Z-][0-9a-zA-Z-]*)(?:\\.(?:0|[1-9]\\d*|\\d*[a-zA-Z-][0-9a-zA-Z-]*))*)?(?:\\+[0-9a-zA-Z-]+(?:\\.[0-9a-zA-Z-]+)*)?$",
      "description": "Semantic version per https://semver.org. Bump on breaking source-level changes."
    },
    "frame": {
      "type": "string",
      "enum": ["bubbletea", "ratatui", "textual", "ink"],
      "description": "Target TUI framework. v0.1 is bubbletea only. Other values are reserved for adapter packs."
    },
    "dependencies": {
      "type": "array",
      "items": {
        "type": "string",
        "pattern": "^[^@\\s]+@[^@\\s]+$",
        "description": "Module-system dependency in the form '<module>@<version>'. The CLI shells `go get` for each on install."
      },
      "uniqueItems": true,
      "description": "Upstream module dependencies (Go modules in v0.1). Use exact-version pins so consumers reproduce."
    },
    "registryDependencies": {
      "type": "array",
      "items": {
        "type": "string",
        "pattern": "^[a-z][a-z0-9-]{0,38}[a-z0-9]$"
      },
      "uniqueItems": true,
      "description": "Other glyph items this one depends on, by name. The CLI walks this graph and installs each first."
    },
    "files": {
      "type": "array",
      "minItems": 1,
      "items": {
        "type": "object",
        "required": ["path", "type", "target"],
        "additionalProperties": false,
        "properties": {
          "path": {
            "type": "string",
            "pattern": "^[^/\\s][^\\s]*[^/\\s]$",
            "description": "Source path within the glyph repo (e.g. 'components/chat-bubble/chat-bubble.go')."
          },
          "type": {
            "type": "string",
            "enum": ["glyph:component", "glyph:test", "glyph:lib"],
            "description": "File kind. Determines which alias the CLI uses to resolve the target."
          },
          "target": {
            "type": "string",
            "pattern": "^@(components|lib|hooks|theme)/[^\\s]+$",
            "description": "Alias-prefixed install path. Resolved against the consumer's glyph.json aliases."
          }
        }
      },
      "description": "Files this item ships. Each is copied into r/<name>/ at build time and rewritten into the consumer's repo at install time."
    },
    "docs": {
      "type": "string",
      "description": "Free-form prose shown alongside the component on the demo site. Pairing tips, idioms, common pitfalls."
    },
    "categories": {
      "type": "array",
      "items": {
        "type": "string",
        "pattern": "^[a-z][a-z0-9-]*$"
      },
      "uniqueItems": true,
      "description": "Tags used by the demo site to group and filter items."
    },
    "meta": {
      "type": "object",
      "additionalProperties": true,
      "description": "Free-form metadata. Conventionally includes `added` (ISO date) and `frame`. Reserved for future use."
    }
  }
}
